{"artifactId":"00000000-0000-4000-8000-000000000101","artifactClass":"RAW","role":"INPUT","key":"raw/sha256/aa/bb/aaaaaaaaaaaaaaaaaaaaaaaaaaaaaaaaaaaaaaaaaaaaaaaaaaaaaaaaaaaaaaaa/payload","mediaType":"application/pdf","byteLength":1024,"checksumAlgorithm":"SHA256","checksum":"aaaaaaaaaaaaaaaaaaaaaaaaaaaaaaaaaaaaaaaaaaaaaaaaaaaaaaaaaaaaaaaa","immutable":true,"createdAt":"2026-07-15T00:00:00.000Z","originalFileName":"report.pdf","language":"ar"}
